source ID,target ID,mapping description
M1021,T1528,"Administrators can block end-user consent to OAuth applications, disabling users from authorizing third-party apps through OAuth 2.0 and forcing administrative consent for all requests. They can also block end-user registration of applications by their users, to reduce risk. A Cloud Access Security Broker can also be used to ban applications.

Azure offers a couple of enterprise policy settings in the Azure Management Portal that may help:

""Users -> User settings -> App registrations: Users can register applications"" can be set to ""no"" to prevent users from registering new applications. 
""Enterprise applications -> User settings -> Enterprise applications: Users can consent to apps accessing company data on their behalf"" can be set to ""no"" to prevent users from consenting to allow third-party multi-tenant applications"
M1021,T1539,"Restrict or block web-based content that could be used to extract session cookies or credentials stored in browsers. Use browser security settings, such as disabling third-party cookies and restricting browser extensions, to limit the attack surface."
M1021,T1218,"Restrict use of certain websites, block downloads/attachments, block Javascript, restrict browser extensions, etc."
M1021,T1127,Consider disabling software installation or execution from the internet via developer utilities.
M1021,T1204,"If a link is being visited by a user, block unknown or unused files in transit by default that should not be downloaded or by policy from suspicious sites as a best practice to prevent some vectors, such as .scr, .exe, .pif, .cpl, etc. Some download scanning devices can open and analyze compressed and encrypted formats, such as zip and rar that may be used to conceal malicious files."
M1021,T1102,Web proxies can be used to enforce external network communication policy that prevents use of unauthorized external services.
M1020,T1573,SSL/TLS inspection can be used to see the contents of encrypted sessions to look for network-based indicators of malware communication protocols.
M1020,T1090,"If it is possible to inspect HTTPS traffic, the captures can be analyzed for connections that appear to be domain fronting."
M1054,T1543,"Where possible, consider enforcing the use of container services in rootless mode to limit the possibility of privilege escalation or malicious effects on the host running the container."
M1054,T1602,Allowlist MIB objects and implement SNMP views.(Citation: Cisco Securing SNMP)
M1054,T1213,Consider implementing data retention policies to automate periodically archiving and/or deleting data that is no longer needed.  
M1054,T1606,Configure browsers/applications to regularly delete persistent web credentials (such as cookies).
M1054,T1562,"Consider implementing policies on internal web servers, such HTTP Strict Transport Security, that enforce the use of HTTPS/network traffic encryption to prevent insecure connections.(Citation: Chromium HSTS)"
M1054,T1559,"Consider disabling embedded files in Office programs, such as OneNote, that do not work with Protected View.(Citation: Enigma Reviving DDE Jan 2018)(Citation: GitHub Disable DDEAUTO Oct 2017)"
M1054,T1666,"In Azure environments, consider setting a policy to block subscription transfers.(Citation: Azure Subscription Policies) In AWS environments, consider using Service Control Policies to prevent the use of the `LeaveOrganization` API call.(Citation: AWS RE:Inforce Threat Detection 2024)"
M1054,T1137,"For the Office Test method, create the Registry key used to execute it and set the permissions to ""Read Control"" to prevent easy access to the key without administrator permissions or requiring Privilege Escalation. (Citation: Palo Alto Office Test Sofacy)"
M1054,T1566,Use anti-spoofing and email authentication mechanisms to filter messages based on validity checks of the sender domain (using SPF) and integrity of messages (using DKIM). Enabling these mechanisms within an organization (through policies such as DMARC) may enable recipients (intra-org and cross domain) to perform similar message filtering and validation.(Citation: Microsoft Anti Spoofing)(Citation: ACSC Email Spoofing)
M1054,T1598,Use anti-spoofing and email authentication mechanisms to filter messages based on validity checks of the sender domain (using SPF) and integrity of messages (using DKIM). Enabling these mechanisms within an organization (through policies such as DMARC) may enable recipients (intra-org and cross domain) to perform similar message filtering and validation.(Citation: Microsoft Anti Spoofing)(Citation: ACSC Email Spoofing)
M1054,T1539,"Configure browsers or tasks to regularly delete persistent cookies.

Additionally, minimize the length of time a web cookie is viable to potentially reduce the impact of stolen cookies while also increasing the needed frequency of cookie theft attempts – providing defenders with additional chances at detection.(Citation: Token tactics) For example, use non-persistent cookies to limit the duration a session ID will remain on the web client cache where an attacker could obtain it.(Citation: Session Management Cheat Sheet)"
M1054,T1553,HTTP Public Key Pinning (HPKP) is one method to mitigate potential [Adversary-in-the-Middle](https://attack.mitre.org/techniques/T1557) situations where and adversary uses a mis-issued or fraudulent certificate to intercept encrypted communications by enforcing use of an expected certificate. (Citation: Wikipedia HPKP)
M1054,T1537,"Configure appropriate data sharing restrictions in cloud services. For example, external sharing in Microsoft SharePoint and Google Drive can be turned off altogether, blocked for certain domains, or restricted to certain users.(Citation: Google Workspace External Sharing) (Citation: Microsoft 365 External Sharing)"
M1054,T1535,Cloud service providers may allow customers to deactivate unused regions.(Citation: CloudSploit - Unused AWS Regions)
M1019,T1212,Develop a robust cyber threat intelligence capability to determine what types and levels of threat may use software exploits and 0-days against a particular organization.
M1019,T1211,Develop a robust cyber threat intelligence capability to determine what types and levels of threat may use software exploits and 0-days against a particular organization.
M1019,T1068,Develop a robust cyber threat intelligence capability to determine what types and levels of threat may use software exploits and 0-days against a particular organization.
M1019,T1210,Develop a robust cyber threat intelligence capability to determine what types and levels of threat may use software exploits and 0-days against a particular organization.
M1019,T1656,Threat intelligence helps defenders and users be aware of and defend against common lures and active campaigns that have been used for impersonation.
M1051,T1548,Perform regular software updates to mitigate exploitation risk.
M1051,T1176,Ensure operating systems and browsers are using the most current version. 
M1051,T1555,Perform regular software updates to mitigate exploitation risk.
M1051,T1602,Keep system images and software updated and migrate to SNMPv3.(Citation: Cisco Blog Legacy Device Attacks)
M1051,T1189,Ensure all browsers and plugins kept updated can help prevent the exploit phase of this technique. Use modern browsers with security features turned on.
M1051,T1546,Perform regular software updates to mitigate exploitation risk.
M1051,T1190,Update software regularly by employing patch management for externally exposed applications.
M1051,T1203,"Perform regular software updates to mitigate exploitation risk. Keeping software up-to-date with the latest security patches helps prevent adversaries from exploiting known vulnerabilities in client software, reducing the risk of successful attacks."
M1051,T1212,Update software regularly by employing patch management for internal enterprise endpoints and servers.
M1051,T1211,Update software regularly by employing patch management for internal enterprise endpoints and servers.
M1051,T1068,Update software regularly by employing patch management for internal enterprise endpoints and servers.
M1051,T1210,Update software regularly by employing patch management for internal enterprise endpoints and servers.
M1051,T1495,Patch the BIOS and other firmware as necessary to prevent successful use of known vulnerabilities.
M1051,T1574,Update software regularly to include patches that fix DLL side-loading vulnerabilities.
M1051,T1137,"For the Outlook methods, blocking macros may be ineffective as the Visual Basic engine used for these features is separate from the macro scripting engine.(Citation: SensePost Outlook Forms) Microsoft has released patches to try to address each issue. Ensure KB3191938 which blocks Outlook Visual Basic and displays a malicious code warning, KB4011091 which disables custom forms by default, and KB4011162 which removes the legacy Home Page feature, are applied to systems.(Citation: SensePost Outlook Home Page)"
M1051,T1542,Patch the BIOS and EFI as necessary.
M1051,T1072,Patch deployment systems regularly to prevent potential remote access through [Exploitation for Privilege Escalation](https://attack.mitre.org/techniques/T1068).
M1051,T1539,"Regularly update web browsers, password managers, and all related software to the latest versions. Keeping software up-to-date reduces the risk of vulnerabilities being exploited by attackers to extract stored credentials or session cookies."
M1051,T1195,"A patch management process should be implemented to check unused dependencies, unmaintained and/or previously vulnerable dependencies, unnecessary features, components, files, and documentation."
M1051,T1552,Apply patch KB2962486 which prevents credentials from being stored in GPPs.(Citation: ADSecurity Finding Passwords in SYSVOL)(Citation: MS14-025)
M1052,T1548,"Although UAC bypass techniques exist, it is still prudent to use the highest enforcement level for UAC when possible and mitigate bypass opportunities that exist with techniques such as [DLL Search Order Hijacking](https://attack.mitre.org/techniques/T1574/001)."
M1052,T1574,"Turn off UAC's privilege elevation for standard users <code>[HKEY_LOCAL_MACHINE\SOFTWARE\Microsoft\Windows\CurrentVersion\Policies\System]</code> to automatically deny elevation requests, add: <code>""ConsentPromptBehaviorUser""=dword:00000000</code>. Consider enabling installer detection for all users by adding: <code>""EnableInstallerDetection""=dword:00000001</code>. This will prompt for a password for installation and also log the attempt. To disable installer detection, instead add: <code>""EnableInstallerDetection""=dword:00000000</code>. This may prevent potential elevation of privileges through exploitation during the process of UAC detecting the installer, but will allow the installation process to continue without being logged.  (Citation: Executable Installers are Vulnerable)"
M1018,T1548,"Limit the privileges of cloud accounts to assume, create, or impersonate additional roles, policies, and permissions to only those required. Where just-in-time access is enabled, consider requiring manual approval for temporary elevation of privileges."
M1018,T1134,An adversary must already have administrator level access on the local system to make full use of this technique; be sure to restrict users and accounts to the least privileges they require.  
M1018,T1087,"Manage the creation, modification, use, and permissions associated to user accounts."
M1018,T1098,Ensure that low-privileged user accounts do not have permissions to modify accounts or account-related policies.
M1018,T1197,"
Consider limiting access to the BITS interface to specific users or groups.(Citation: Symantec BITS May 2007)"
M1018,T1185,"Since browser pivoting requires a high integrity process to launch from, restricting user permissions and addressing Privilege Escalation and [Bypass User Account Control](https://attack.mitre.org/techniques/T1548/002) opportunities can limit the exposure to this technique."
M1018,T1110,"Proactively reset accounts that are known to be part of breached credentials either immediately, or after detecting bruteforce attempts."
M1018,T1580,"Limit permissions to discover cloud infrastructure in accordance with least privilege. Organizations should limit the number of users within the organization with an IAM role that has administrative privileges, strive to reduce all permanent privileged role assignments, and conduct periodic entitlement reviews on IAM users, roles and policies."
M1018,T1538,Enforce the principle of least-privilege by limiting dashboard visibility to only the resources required. This may limit the discovery value of the dashboard in the event of a compromised account.
M1018,T1619,Restrict granting of permissions related to listing objects in cloud storage to necessary accounts.
M1018,T1609,"Enforce authentication and role-based access control on the container service to restrict users to the least privileges required.(Citation: Kubernetes Hardening Guide) When using Kubernetes, avoid giving users wildcard permissions or adding users to the `system:masters` group, and use `RoleBindings` rather than `ClusterRoleBindings` to limit user privileges to specific namespaces.(Citation: Kubernetes RBAC)"
M1018,T1613,"Enforce the principle of least privilege by limiting dashboard visibility to only the required users. When using Kubernetes, avoid giving users wildcard permissions or adding users to the `system:masters` group, and use `RoleBindings` rather than `ClusterRoleBindings` to limit user privileges to specific namespaces.(Citation: Kubernetes RBAC)"
M1018,T1543,Limit privileges of user accounts and groups so that only authorized administrators can interact with system-level process changes and service configurations.
M1018,T1485,"In cloud environments, limit permissions to modify cloud bucket lifecycle policies (e.g., `PutLifecycleConfiguration` in AWS) to only those accounts that require it. In AWS environments, consider using Service Control policies to limit the use of the `PutBucketLifecycle` API call. "
M1018,T1530,"Configure user permissions groups and roles for access to cloud storage.(Citation: Microsoft Azure Storage Security, 2019) Implement strict Identity and Access Management (IAM) controls to prevent access to storage solutions except for the applications, users, and services that require access.(Citation: Amazon S3 Security, 2019) Ensure that temporary access tokens are issued rather than permanent credentials, especially when access is being granted to entities outside of the internal security boundary.(Citation: Amazon  AWS Temporary Security Credentials)"
M1018,T1213,Enforce the principle of least-privilege. Consider implementing access control mechanisms that include both authentication and authorization.
M1018,T1610,"Enforce the principle of least privilege by limiting container dashboard access to only the necessary users. When using Kubernetes, avoid giving users wildcard permissions or adding users to the `system:masters` group, and use `RoleBindings` rather than `ClusterRoleBindings` to limit user privileges to specific namespaces.(Citation: Kubernetes RBAC)"
M1018,T1006,Ensure only accounts required to configure and manage backups have the privileges to do so. Monitor these accounts for unauthorized backup activity.
M1018,T1484,Consider implementing WMI and security filtering to further tailor which users and computers a GPO will apply to.(Citation: Wald0 Guide to GPOs)(Citation: Microsoft WMI Filters)(Citation: Microsoft GPO Security Filtering)
M1018,T1048,"Configure user permissions groups and roles for access to cloud storage.(Citation: Microsoft Azure Storage Security, 2019) Implement strict Identity and Access Management (IAM) controls to prevent access to storage solutions except for the applications, users, and services that require access.(Citation: Amazon S3 Security, 2019) Ensure that temporary access tokens are issued rather than permanent credentials, especially when access is being granted to entities outside of the internal security boundary.(Citation: Amazon  AWS Temporary Security Credentials)"
M1018,T1657,"Limit access/authority to execute sensitive transactions, and switch to systems and procedures designed to authenticate/approve payments and purchase requests outside of insecure communication lines such as email."
M1018,T1606,"Ensure that user accounts with administrative rights follow best practices, including use of privileged access workstations, Just in Time/Just Enough Administration (JIT/JEA), and strong authentication. Reduce the number of users that are members of highly privileged Directory Roles.(Citation: Microsoft SolarWinds Customer Guidance) In AWS environments, prohibit users from calling the `sts:GetFederationToken` API unless explicitly required.(Citation: Crowdstrike AWS User Federation Persistence)"
M1018,T1574,"Limit privileges of user accounts and groups so that only authorized administrators can interact with service changes and service binary target path locations. Deny execution from user directories such as file download directories and temp directories where able.

Ensure that proper permissions and directory access control are set to deny users the ability to write files to the top-level directory <code>C:</code> and system directories, such as <code>C:\Windows\</code>, to reduce places where malicious files could be placed for execution."
M1018,T1562,Ensure proper user permissions are in place to prevent adversaries from disabling or interfering with security/logging services.
M1018,T1490,"Limit the user accounts that have access to backups to only those required. In AWS environments, consider using Service Control Policies to restrict API calls to delete backups, snapshots, and images. "
M1018,T1654,Limit the ability to access and export sensitive logs to privileged accounts where possible.
M1018,T1036,Consider defining and enforcing a naming convention for user accounts to more easily spot generic account names that do not fit the typical schema.
M1018,T1556,"Ensure that proper policies are implemented to dictate the the secure enrollment and deactivation of authentication mechanisms, such as MFA, for user accounts."
M1018,T1578,"Limit permissions for creating, deleting, and otherwise altering compute components in accordance with least privilege. Organizations should limit the number of users within the organization with an IAM role that has administrative privileges, strive to reduce all permanent privileged role assignments, and conduct periodic entitlement reviews on IAM users, roles and policies.(Citation: Mandiant M-Trends 2020)"
M1018,T1666,"Limit permissions to add, delete, or modify resource groups to only those required. "
M1018,T1040,"In cloud environments, ensure that users are not granted permissions to create or modify traffic mirrors unless this is explicitly required."
M1018,T1563,Limit remote user permissions if remote access is necessary.
M1018,T1021,"Limit the accounts that may use remote services. Limit the permissions for accounts that are at higher risk of compromise; for example, configure SSH so users can only run specific programs."
M1018,T1053,Limit privileges of user accounts and remediate Privilege Escalation vectors so only authorized administrators can create scheduled tasks on remote systems.
M1018,T1505,Enforce the principle of least privilege by limiting privileges of user accounts so only authorized accounts can modify and/or add server software components.(Citation: NSA and ASD Detect and Prevent Web Shells 2020)
M1018,T1648,"Remove permissions to create, modify, or run serverless resources from users that do not explicitly require them."
M1018,T1489,Limit privileges of user accounts and groups so that only authorized administrators can interact with service changes and service configurations.
M1018,T1072,"Ensure that any accounts used by third-party providers to access these systems are traceable to the third-party and are not used throughout the network or used by other third-party providers in the same environment. Ensure there are regular reviews of accounts provisioned to these systems to verify continued business need, and ensure there is governance to trace de-provisioning of access that is no longer required. Ensure proper system and access isolation for critical network systems through use of account privilege separation."
M1018,T1528,"Enforce role-based access control to limit accounts to the least privileges they require. A Cloud Access Security Broker (CASB) can be used to set usage policies and manage user permissions on cloud applications to prevent access to application access tokens. In Kubernetes applications, set “automountServiceAccountToken: false” in the YAML specification of pods that do not require access to service account tokens.(Citation: Kubernetes Hardening Guide)"
M1018,T1195,"Implement robust user account management practices to limit permissions associated with software execution. Ensure that software runs with the lowest necessary privileges, avoiding the use of root or administrator accounts when possible. By restricting permissions, you can minimize the risk of propagation and unauthorized actions in the event of a supply chain compromise, reducing the attack surface for adversaries to exploit within compromised systems."
M1018,T1569,Prevent users from installing their own launch agents or launch daemons.
M1018,T1537,Limit user account and IAM policies to the least privileges required.
M1018,T1199,"Properly manage accounts and permissions used by parties in trusted relationships to minimize potential abuse by the party and if the party is compromised by an adversary. In Office 365 environments, partner relationships and roles can be viewed under the “Partner Relationships” page.(Citation: Office 365 Partner Relationships)
"
M1018,T1550,Enforce the principle of least-privilege. Do not allow a domain user to be in the local administrator group on multiple systems.
M1018,T1078,Regularly audit user accounts for activity and deactivate or remove any that are no longer needed.
M1018,T1047,"By default, only administrators are allowed to connect remotely using WMI. Restrict other users who are allowed to connect, or disallow all users to connect remotely to WMI."
M1017,T1557,Train users to be suspicious about certificate errors. Adversaries may use their own certificates in an attempt to intercept HTTPS traffic. Certificate errors may arise when the application’s certificate does not match the one expected by the host.
M1017,T1176,"
Close out all browser sessions when finished using them to prevent any potentially malicious extensions from continuing to run."
M1017,T1185,Close all browser sessions regularly and when they are no longer needed.
M1017,T1213,Develop and publish policies that define acceptable information to be stored in repositories.
M1017,T1657,"Train and encourage users to identify social engineering techniques used to enable financial theft. Also consider training users on procedures to prevent and respond to swatting and doxing, acts increasingly deployed by financially motivated groups to further coerce victims into satisfying ransom/extortion demands.(Citation: Cyber Safety Review Board: Lapsus)(Citation: SWAT-hospital)"
M1017,T1656,"Train users to be aware of impersonation tricks and how to counter them, for example confirming incoming requests through an independent platform like a phone call or in-person, to reduce risk."
M1017,T1036,Train users not to open email attachments or click unknown links (URLs). Such training fosters more secure habits within your organization and will limit many of the risks.  
M1017,T1111,Remove smart cards when not in use.
M1017,T1621,"Train users to only accept 2FA/MFA requests from login attempts they initiated, to review source location of the login attempt prompting the 2FA/MFA requests, and to report suspicious/unsolicited prompts."
M1017,T1003,Limit credential overlap across accounts and systems by training users and administrators not to use the same password for multiple accounts.
M1017,T1027,Ensure that a finite amount of ingress points to a software deployment system exist with restricted access for those required to allow and enable newly deployed software.
M1017,T1566,Users can be trained to identify social engineering techniques and phishing emails.
M1017,T1598,Users can be trained to identify social engineering techniques and spearphishing attempts.
M1017,T1072,Have a strict approval policy for use of deployment systems.
M1017,T1528,"Users need to be trained to not authorize third-party applications they don’t recognize. The user should pay particular attention to the redirect URL: if the URL is a misspelled or convoluted sequence of words related to an expected service or SaaS application, the website is likely trying to spoof a legitimate service. Users should also be cautious about the permissions they are granting to apps. For example, offline access and access to read emails should excite higher suspicions because adversaries can utilize SaaS APIs to discover credentials and other sensitive communications."
M1017,T1539,"Train users to identify aspects of phishing attempts where they're asked to enter credentials into a site that has the incorrect domain for the application they are logging into. Additionally, train users not to run untrusted JavaScript in their browser, such as by copying and pasting code or dragging and dropping bookmarklets."
M1017,T1221,Train users to identify social engineering techniques and spearphishing emails that could be used to deliver malicious documents.
