source ID,target ID,mapping description
M1043,T1003,"With Windows 10, Microsoft implemented new protections called Credential Guard to protect the LSA secrets that can be used to obtain credentials through forms of credential dumping. It is not configured by default and has hardware and firmware system requirements. (Citation: TechNet Credential Guard) It also does not protect against all forms of credential dumping. (Citation: GitHub SHB Credential Guard)"
M1043,T1558,"On Linux systems, protect resources with Security Enhanced Linux (SELinux) by defining entry points, process types, and file labels.(Citation: Brining MimiKatz to Unix) "
M1053,T1485,Consider implementing IT disaster recovery plans that contain procedures for taking regular data backups that can be used to restore organizational data.(Citation: Ready.gov IT DRP) Ensure backups are stored off system and protected from common methods adversaries may use to gain access and destroy the backups to prevent recovery.
M1053,T1486,Consider implementing IT disaster recovery plans that contain procedures for regularly taking and testing data backups that can be used to restore organizational data.(Citation: Ready.gov IT DRP) Ensure backups are stored off system and is protected from common methods adversaries may use to gain access and destroy the backups to prevent recovery. Consider enabling versioning in cloud environments to maintain backup copies of storage objects.(Citation: Rhino S3 Ransomware Part 2)
M1053,T1491,"Consider implementing IT disaster recovery plans that contain procedures for taking regular data backups that can be used to restore organizational data.(Citation: Ready.gov IT DRP) Ensure backups are stored off system and is protected from common methods adversaries may use to gain access and destroy the backups to prevent recovery.
"
M1053,T1561,Consider implementing IT disaster recovery plans that contain procedures for taking regular data backups that can be used to restore organizational data.(Citation: Ready.gov IT DRP) Ensure backups are stored off system and is protected from common methods adversaries may use to gain access and destroy the backups to prevent recovery.
M1053,T1490,"Consider implementing IT disaster recovery plans that contain procedures for taking regular data backups that can be used to restore organizational data.(Citation: Ready.gov IT DRP) Ensure backups are stored off system and is protected from common methods adversaries may use to gain access and destroy the backups to prevent recovery. In cloud environments, enable versioning on storage objects where possible, and copy backups to other accounts or regions to isolate them from the original copies.(Citation: Unit 42 Palo Alto Ransomware in Public Clouds 2022)"
M1057,T1005,Data loss prevention can restrict access to sensitive data and detect sensitive data that is unencrypted.
M1057,T1025,Data loss prevention can restrict access to sensitive data and detect sensitive data that is unencrypted.
M1057,T1048,Data loss prevention can detect and block sensitive data being uploaded via web browsers.
M1057,T1041,Data loss prevention can detect and block sensitive data being sent over unencrypted protocols.
M1057,T1052,Data loss prevention can detect and block sensitive data being copied to physical mediums.
M1057,T1567,Data loss prevention can be detect and block sensitive data being uploaded to web services via web browsers.
M1057,T1537,Data loss prevention can prevent and block sensitive data from being shared with individuals outside an organization.(Citation: Microsoft Purview Data Loss Prevention) (Citation: Google Workspace Data Loss Prevention)
M1042,T1098,Remove unnecessary and potentially abusable authentication and authorization mechanisms where possible.
M1042,T1557,"Disable legacy network protocols that may be used   to intercept network traffic if applicable, especially those that are not needed within an environment."
M1042,T1059,Disable or remove any unnecessary or unused shells or interpreters.
M1042,T1092,Disable Autoruns if it is unnecessary.(Citation: Microsoft Disable Autorun)
M1042,T1609,Remove unnecessary tools and software from containers.
M1042,T1611,Remove unnecessary tools and software from containers.
M1042,T1011,"Disable WiFi connection, modem, cellular data connection, Bluetooth, or another radio frequency (RF) channel in local computer security settings or by group policy if it is not needed within an environment."
M1042,T1052,Disable Autorun if it is unnecessary. (Citation: Microsoft Disable Autorun) Disallow or restrict removable media at an organizational policy level if they are not required for business operations. (Citation: TechNet Removable Media Control)
M1042,T1210,Minimize available services to only those that are necessary.
M1042,T1133,Disable or block remotely available services that may be unnecessary.
M1042,T1559,"Registry keys specific to Microsoft Office feature control security can be set to disable automatic DDE/OLE execution. (Citation: Microsoft DDE Advisory Nov 2017)(Citation: BleepingComputer DDE Disabled in Word Dec 2017)(Citation: GitHub Disable DDEAUTO Oct 2017) Microsoft also created, and enabled by default, Registry keys to completely disable DDE execution in Word and Excel.(Citation: Microsoft ADV170021 Dec 2017)"
M1042,T1046,Ensure that unnecessary ports and services are closed to prevent risk of discovery and potential exploitation.
M1042,T1137,"Follow Office macro security best practices suitable for your environment. Disable Office VBA macros from executing.

Disable Office add-ins. If they are required, follow best practices for securing them by requiring them to be signed and disabling user notification for allowing add-ins. For some add-ins types (WLL, VBA) additional mitigation is likely required as disabling add-ins in the Office Trust Center does not disable WLL nor does it prevent VBA code from executing. (Citation: MRWLabs Office Persistence Add-ins)"
M1042,T1219,"Consider disabling unnecessary remote connection functionality, including both unapproved software installations and specific features built into supported applications."
M1042,T1563,"Disable the remote service (ex: SSH, RDP, etc.) if it is unnecessary."
M1042,T1021,"If remote services, such as the ability to make direct connections to cloud virtual machines, are not required, disable these connection types where feasible."
M1042,T1091,Disable Autorun if it is unnecessary. (Citation: Microsoft Disable Autorun) Disallow or restrict removable media at an organizational policy level if it is not required for business operations. (Citation: TechNet Removable Media Control)
M1042,T1505,Consider disabling software components from servers when possible to prevent abuse by adversaries.(Citation: ITSyndicate Disabling PHP functions)
M1042,T1649,"Consider disabling old/dangerous authentication protocols (e.g. NTLM), as well as unnecessary certificate features, such as potentially vulnerable AD CS web and other enrollment server roles.(Citation: SpecterOps Certified Pre Owned)"
M1042,T1218,Many native binaries may not be necessary within a given environment.
M1042,T1221,"Consider disabling Microsoft Office macros/active content to prevent the execution of malicious payloads in documents (Citation: Microsoft Disable Macros), though this setting may not mitigate the [Forced Authentication](https://attack.mitre.org/techniques/T1187) use for this technique."
M1042,T1205,Disable Wake-on-LAN if it is not needed within an environment.
M1042,T1127,Specific developer utilities may not be necessary within a given environment and should be removed if not used.
M1055,T1480,"[Execution Guardrails](https://attack.mitre.org/techniques/T1480) likely should not be mitigated with preventative controls because it may protect unintended targets from being compromised. If targeted, efforts should be focused on preventing adversary tools from running earlier in the chain of activity and on identifying subsequent malicious behavior if compromised."
M1041,T1557,"Ensure that all wired and/or wireless traffic is encrypted appropriately. Use best practices for authentication protocols, such as Kerberos, and ensure web traffic that may contain credentials is protected by SSL/TLS."
M1041,T1119,"Encryption and off-system storage of sensitive information may be one way to mitigate collection of files, but may not stop an adversary from acquiring the information if an intrusion persists over a long period of time and the adversary is able to discover and access the data through other means. Strong passwords should be used on certain encrypted documents that use them to prevent offline cracking through [Brute Force](https://attack.mitre.org/techniques/T1110) techniques."
M1041,T1659,"Where possible, ensure that online traffic is appropriately encrypted through services such as trusted VPNs."
M1041,T1565,Consider encrypting important information to reduce an adversary’s ability to perform tailored data modifications.
M1041,T1530,"Encrypt data stored at rest in cloud storage.(Citation: Amazon S3 Security, 2019)(Citation: Microsoft Azure Storage Security, 2019) Managed encryption keys can be rotated by most providers. At a minimum, ensure an incident response plan to storage breach includes rotating the keys and test for impact on client applications.(Citation: Google Cloud Encryption Key Rotation)"
M1041,T1602,Configure SNMPv3 to use the highest level of security (authPriv) available.(Citation: US-CERT TA17-156A SNMP Abuse 2017)
M1041,T1213,Encrypt data stored at rest in databases. 
M1041,T1114,Use of encryption provides an added layer of security to sensitive information sent over email. Encryption using public key cryptography requires the adversary to obtain the private certificate along with an encryption key to decrypt messages.
M1041,T1070,Obfuscate/encrypt event files locally and in transit to avoid giving feedback to an adversary.
M1041,T1040,"Ensure that all wired and/or wireless traffic is encrypted appropriately. Use best practices for authentication protocols, such as Kerberos, and ensure web traffic that may contain credentials is protected by SSL/TLS."
M1041,T1003,Ensure Domain Controller backups are properly secured.
M1041,T1649,"Ensure certificates as well as associated private keys are appropriately secured. Consider utilizing additional hardware credential protections such as trusted platform modules (TPM) or hardware security modules (HSM). Enforce HTTPS and enable Extended Protection for
Authentication.(Citation: SpecterOps Certified Pre Owned)"
M1041,T1558,"Enable AES Kerberos encryption (or another stronger encryption algorithm), rather than RC4, where possible.(Citation: AdSecurity Cracking Kerberos Dec 2015)"
M1041,T1552,"When possible, store keys on separate cryptographic hardware instead of on the local system. "
M1038,T1548,System settings can prevent applications from running that haven't been downloaded from legitimate repositories which may help mitigate some of these issues. Not allowing unsigned applications from being run may also mitigate some risk.
M1038,T1176,Set a browser extension allow or deny list as appropriate for your security policy. (Citation: Technospot Chrome Extensions GP)
M1038,T1059,"Use application control where appropriate. For example, PowerShell Constrained Language mode can be used to restrict access to sensitive or otherwise dangerous language elements such as those used to execute arbitrary Windows APIs or files (e.g., `Add-Type`).(Citation: Microsoft PowerShell CLM)"
M1038,T1609,"Use read-only containers, read-only file systems, and minimal images when possible to prevent the execution of commands.(Citation: Kubernetes Hardening Guide) Where possible, also consider using application control and software restriction tools (such as those provided by SELinux) to restrict access to files, processes, and system calls in containers.(Citation: Kubernetes Security Context)"
M1038,T1611,"Use read-only containers, read-only file systems, and minimal images when possible to prevent the running of commands.(Citation: Kubernetes Hardening Guide) Where possible, also consider using application control and software restriction tools (such as those provided by SELinux) to restrict access to files, processes, and system calls in containers.(Citation: Kubernetes Security Context)"
M1038,T1068,Consider blocking the execution of known vulnerable drivers that adversaries may exploit to execute code in kernel mode. Validate driver block rules in audit mode to ensure stability prior to production deployment.(Citation: Microsoft Driver Block Rules)
M1038,T1574,Adversaries may use new payloads to execute this technique. Identify and block potentially malicious software executed through hijacking by using application control solutions also capable of blocking libraries loaded by legitimate software.
M1038,T1562,"Use application control where appropriate, especially regarding the execution of tools outside of the organization's security policies (such as rootkit removal tools) that have been abused to impair system defenses. Ensure that only approved security applications are used and running on enterprise systems."
M1038,T1490,Consider using application control configured to block execution of utilities such as `diskshadow.exe` that may not be required for a given system or network to prevent potential misuse by adversaries. 
M1038,T1036,Use tools that restrict program execution via application control by attributes other than file name for common operating system utilities that are needed.
M1038,T1106,"Identify and block potentially malicious software executed that may be executed through this technique by using application control (Citation: Beechey 2010) tools, like Windows Defender Application Control(Citation: Microsoft Windows Defender Application Control), AppLocker, (Citation: Windows Commands JPCERT) (Citation: NSA MS AppLocker) or Software Restriction Policies (Citation: Corio 2008) where appropriate. (Citation: TechNet Applocker vs SRP)"
M1038,T1219,Use application control to mitigate installation and use of unapproved software that can be used for remote access.
M1038,T1129,Identify and block potentially malicious software executed through this technique by using application control tools capable of preventing unknown modules from being loaded.
M1038,T1553,System settings can prevent applications from running that haven't been downloaded through the Apple Store (or other legitimate repositories) which can help mitigate some of these issues. Also enable application control solutions such as AppLocker and/or Device Guard to block the loading of malicious content.
M1038,T1218,Consider using application control to prevent execution of binaries that are susceptible to abuse and not required for a given system or network.
M1038,T1216,Certain signed scripts that can be used to execute other programs may not be necessary within a given environment. Use application control configured to block execution of these scripts if they are not required for a given system or network to prevent potential misuse by adversaries.
M1038,T1080,"Identify potentially malicious software that may be used to taint content or may result from it and audit and/or block the unknown programs by using application control (Citation: Beechey 2010) tools, like AppLocker, (Citation: Windows Commands JPCERT) (Citation: NSA MS AppLocker) or Software Restriction Policies (Citation: Corio 2008) where appropriate. (Citation: TechNet Applocker vs SRP)"
M1038,T1127,Certain developer utilities should be blocked or restricted if not required.
M1038,T1204,Application control may be able to prevent the running of executables masquerading as other files.
M1038,T1047,"Use application control configured to block execution of <code>wmic.exe</code> if it is not required for a given system or network to prevent potential misuse by adversaries. For example, in Windows 10 and Windows Server 2016 and above, Windows Defender Application Control (WDAC) policy rules may be applied to block the <code>wmic.exe</code> application and to prevent abuse.(Citation: Microsoft WDAC)"
M1038,T1220,"If msxsl.exe is unnecessary, then block its execution to prevent abuse by adversaries."
M1050,T1189,Security applications that look for behavior used during exploitation such as Windows Defender Exploit Guard (WDEG) and the Enhanced Mitigation Experience Toolkit (EMET) can be used to mitigate some exploitation behavior. (Citation: TechNet Moving Beyond EMET) Control flow integrity checking is another way to potentially identify and stop a software exploit from occurring. (Citation: Wikipedia Control Flow Integrity) Many of these protections depend on the architecture and target application binary for compatibility.
M1050,T1190,Web Application Firewalls may be used to limit exposure of applications to prevent exploit traffic from reaching the application.
M1050,T1203,Security applications that look for behavior used during exploitation such as Windows Defender Exploit Guard (WDEG) and the Enhanced Mitigation Experience Toolkit (EMET) can be used to mitigate some exploitation behavior. (Citation: TechNet Moving Beyond EMET) Control flow integrity checking is another way to potentially identify and stop a software exploit from occurring. (Citation: Wikipedia Control Flow Integrity) Many of these protections depend on the architecture and target application binary for compatibility.
M1050,T1212,Security applications that look for behavior used during exploitation such as Windows Defender Exploit Guard (WDEG) and the Enhanced Mitigation Experience Toolkit (EMET) can be used to mitigate some exploitation behavior.(Citation: TechNet Moving Beyond EMET) Control flow integrity checking is another way to potentially identify and stop a software exploit from occurring.(Citation: Wikipedia Control Flow Integrity) Many of these protections depend on the architecture and target application binary for compatibility and may not work for software targeted for defense evasion.
M1050,T1211,Security applications that look for behavior used during exploitation such as Windows Defender Exploit Guard (WDEG) and the Enhanced Mitigation Experience Toolkit (EMET) can be used to mitigate some exploitation behavior. (Citation: TechNet Moving Beyond EMET) Control flow integrity checking is another way to potentially identify and stop a software exploit from occurring. (Citation: Wikipedia Control Flow Integrity) Many of these protections depend on the architecture and target application binary for compatibility and may not work for software targeted for defense evasion.
M1050,T1068,Security applications that look for behavior used during exploitation such as Windows Defender Exploit Guard (WDEG) and the Enhanced Mitigation Experience Toolkit (EMET) can be used to mitigate some exploitation behavior. (Citation: TechNet Moving Beyond EMET) Control flow integrity checking is another way to potentially identify and stop a software exploit from occurring. (Citation: Wikipedia Control Flow Integrity) Many of these protections depend on the architecture and target application binary for compatibility and may not work for software components targeted for privilege escalation.
M1050,T1210,Security applications that look for behavior used during exploitation such as Windows Defender Exploit Guard (WDEG) and the Enhanced Mitigation Experience Toolkit (EMET) can be used to mitigate some exploitation behavior. (Citation: TechNet Moving Beyond EMET) Control flow integrity checking is another way to potentially identify and stop a software exploit from occurring. (Citation: Wikipedia Control Flow Integrity) Many of these protections depend on the architecture and target application binary for compatibility and may not work for all software or services targeted.
M1050,T1218,Microsoft's Enhanced Mitigation Experience Toolkit (EMET) Attack Surface Reduction (ASR) feature can be used to block methods of using using trusted binaries to bypass application control.
M1050,T1080,"Use utilities that detect or mitigate common features used in exploitation, such as the Microsoft Enhanced Mitigation Experience Toolkit (EMET)."
M1037,T1557,"Use network appliances and host-based security software to block network traffic that is not necessary within the environment, such as legacy protocols that may be leveraged for AiTM conditions."
M1037,T1071,Use network appliances to filter ingress or egress traffic and perform protocol-based filtering. Configure software on endpoints to filter network traffic.
M1037,T1197,"Modify network and/or host firewall rules, as well as other network controls, to only allow legitimate BITS traffic."
M1037,T1530,Cloud service providers support IP-based restrictions when accessing cloud resources. Consider using IP allowlisting along with user account management to ensure that data access is restricted not only to valid users but only from expected IP ranges to mitigate the use of stolen credentials to access data.
M1037,T1602,Apply extended ACLs to block unauthorized protocols outside the trusted network.(Citation: US-CERT TA17-156A SNMP Abuse 2017)
M1037,T1499,"Leverage services provided by Content Delivery Networks (CDN) or providers specializing in DoS mitigations to filter traffic upstream from services.(Citation: CERT-EU DDoS March 2017) Filter boundary traffic by blocking source addresses sourcing the attack, blocking ports that are being targeted, or blocking protocols being used for transport. To defend against SYN floods, enable SYN Cookies."
M1037,T1048,"Enforce proxies and use dedicated servers for services such as DNS and only allow those systems to communicate over respective ports/protocols, instead of all systems within a network. Cloud service providers support IP-based restrictions when accessing cloud resources. Consider using IP allowlisting along with user account management to ensure that data access is restricted not only to valid users but only from expected IP ranges to mitigate the use of stolen credentials to access data."
M1037,T1187,"
Block SMB traffic from exiting an enterprise network with egress filtering or by blocking TCP ports 139, 445 and UDP port 137. Filter or block WebDAV protocol traffic from exiting the network. If access to external resources over SMB and WebDAV is necessary, then traffic should be tightly limited with allowlisting. (Citation: US-CERT SMB Security) (Citation: US-CERT APT Energy Oct 2017)"
M1037,T1570,Consider using the host firewall to restrict file sharing communications such as SMB. (Citation: Microsoft Preventing SMB)
M1037,T1599,"Upon identifying a compromised network device being used to bridge a network boundary, block the malicious packets using an unaffected network device in path, such as a firewall or a router that has not been compromised.  Continue to monitor for additional activity and to ensure that the blocks are indeed effective."
M1037,T1498,"When flood volumes exceed the capacity of the network connection being targeted, it is typically necessary to intercept the incoming traffic upstream to filter out the attack traffic from the legitimate traffic. Such defenses can be provided by the hosting Internet Service Provider (ISP) or by a 3rd party such as a Content Delivery Network (CDN) or providers specializing in DoS mitigations.(Citation: CERT-EU DDoS March 2017)

Depending on flood volume, on-premises filtering may be possible by blocking source addresses sourcing the attack, blocking ports that are being targeted, or blocking protocols being used for transport.(Citation: CERT-EU DDoS March 2017)

As immediate response may require rapid engagement of 3rd parties, analyze the risk associated to critical resources being affected by Network DoS attacks and create a disaster recovery plan/business continuity plan to respond to incidents.(Citation: CERT-EU DDoS March 2017)"
M1037,T1095,Filter network traffic to prevent use of protocols across the network boundary that are unnecessary.
M1037,T1572,Consider filtering network traffic to untrusted or known bad domains and resources. 
M1037,T1090,Traffic to known anonymity networks and C2 infrastructure can be blocked through the use of network allow and block lists. It should be noted that this kind of blocking may be circumvented by other techniques like [Domain Fronting](https://attack.mitre.org/techniques/T1090/004).
M1037,T1219,"Properly configure firewalls, application firewalls, and proxies to limit outgoing traffic to sites and services used by remote access software."
M1037,T1218,Use network appliances to filter ingress or egress traffic and perform protocol-based filtering. Configure software on endpoints to filter network traffic.
M1037,T1205,"Mitigation of some variants of this technique could be achieved through the use of stateful firewalls, depending upon how it is implemented."
M1037,T1537,Implement network-based filtering restrictions to prohibit data transfers to untrusted VPCs.
M1037,T1552,Limit access to the Instance Metadata API. A properly configured Web Application Firewall (WAF) may help prevent external adversaries from exploiting Server-side Request Forgery (SSRF) attacks that allow access to the Cloud Instance Metadata API.(Citation: RedLock Instance Metadata API 2018)
M1035,T1557,Limit access to network infrastructure and resources that can be used to reshape traffic or otherwise produce AiTM conditions.
M1035,T1612,"Limit communications with the container service to local Unix sockets or remote access via SSH. Require secure port access to communicate with the APIs over TLS by disabling unauthenticated access to the Docker API on port 2375. Instead, communicate with the Docker API over TLS on port 2376.(Citation: Docker Daemon Socket Protect)"
