source ID,target ID,mapping description
M1036,T1110,"Set account lockout policies after a certain number of failed login attempts to prevent passwords from being guessed. Too strict a policy may create a denial of service condition and render environments un-usable, with all accounts used in the brute force being locked-out. Use conditional access policies to block logins from non-compliant devices or from outside defined organization IP ranges.(Citation: Microsoft Common Conditional Access Policies) Consider blocking risky authentication requests, such as those originating from anonymizing services/proxies.(Citation: Okta Block Anonymizing Services)"
M1036,T1621,"Enable account restrictions to prevent login attempts, and the subsequent 2FA/MFA service requests, from being initiated from suspicious locations or when the source of the login attempts do not match the location of the 2FA/MFA smart device. Use conditional access policies to block logins from non-compliant devices or from outside defined organization IP ranges.(Citation: Microsoft Common Conditional Access Policies)"
M1036,T1648,"Where possible, consider restricting access to and use of serverless functions. For examples, conditional access policies can be applied to users attempting to create workflows in Microsoft Power Automate. Google Apps Scripts that use OAuth can be limited by restricting access to high-risk OAuth scopes.(Citation: Microsoft Developer Support Power Apps Conditional Access)(Citation: Google Workspace Apps Script Restrict OAuth Scopes)"
M1036,T1550,"Where possible, consider restricting the use of authentication material outside of expected contexts."
M1036,T1078,Use conditional access policies to block logins from non-compliant devices or from outside defined organization IP ranges.(Citation: Microsoft Common Conditional Access Policies)
M1015,T1003,"
Manage the access control list for “Replicating Directory Changes All” and other permissions associated with domain controller replication. (Citation: AdSecurity DCSync Sept 2015) (Citation: Microsoft Replication ACL) Consider adding users to the ""Protected Users"" Active Directory security group. This can help limit the caching of users' plaintext credentials.(Citation: Microsoft Protected Users Security Group)"
M1015,T1072,Ensure proper system and access isolation for critical network systems through use of group policy.
M1015,T1649,"Ensure certificate authorities (CA) are properly secured, including treating CA servers (and other resources hosting CA certificates) as tier 0 assets. Harden abusable CA settings and attributes.

For example, consider disabling the usage of AD CS certificate SANs within relevant authentication protocol settings to enforce strict user mappings and prevent certificates from authenticating as other identifies.(Citation: SpecterOps Certified Pre Owned) Also consider enforcing CA Certificate Manager approval for the templates that include SAN as an issuance requirement."
M1015,T1558,"For containing the impact of a previously generated golden ticket, reset the built-in KRBTGT account password twice, which will invalidate any existing golden tickets that have been created with the KRBTGT hash and other Kerberos tickets derived from it. For each domain, change the KRBTGT account password once, force replication, and then change the password a second time. Consider rotating the KRBTGT account password every 180 days.(Citation: STIG krbtgt reset)"
M1015,T1552,Remove vulnerable Group Policy Preferences.(Citation: Microsoft MS14-025)
M1015,T1550,"Configure Active Directory to prevent use of certain techniques; use SID Filtering, etc."
M1015,T1078,"Disable legacy authentication, which does not support MFA, and require the use of modern authentication protocols instead."
M1049,T1059,Anti-virus can be used to automatically quarantine suspicious files. 
M1049,T1564,"Review and audit file/folder exclusions, and limit scope of exclusions to only what is required where possible.(Citation: Microsoft File Folder Exclusions)"
M1049,T1036,Anti-virus can be used to automatically quarantine suspicious files.
M1049,T1027,Anti-virus can be used to automatically detect and quarantine suspicious files. Consider utilizing the Antimalware Scan Interface (AMSI) on Windows 10+ to analyze commands after being processed/interpreted. (Citation: Microsoft AMSI June 2015)
M1049,T1566,Anti-virus can automatically quarantine suspicious files.
M1049,T1080,Anti-virus can be used to automatically quarantine suspicious files.(Citation: Mandiant Cloudy Logs 2023)
M1049,T1221,"Network/Host intrusion prevention systems, antivirus, and detonation chambers can be employed to prevent documents from fetching and/or executing malicious payloads.(Citation: Anomali Template Injection MAR 2018)"
M1013,T1212,"Application developers should consider taking measures to validate authentication requests by enabling one-time passwords, providing timestamps or sequence numbers for messages sent, using digital signatures, and/or using random session keys.(Citation: Comparitech Replay Attack)(Citation: Bugcrowd Replay Attack)"
M1013,T1564,"Application developers should consider limiting the requirements for custom or otherwise difficult to manage file/folder exclusions. Where possible, install applications to trusted system folder paths that are already protected by restricted file and directory permissions."
M1013,T1574,"When possible, include hash values in manifest files to help prevent side-loading of malicious libraries.(Citation: FireEye DLL Side-Loading)"
M1013,T1559,Enable the Hardened Runtime capability when developing applications. Do not include the <code>com.apple.security.get-task-allow</code> entitlement with the value set to any variation of true. 
M1013,T1647,Ensure applications are using Apple's developer guidance which enables hardened runtime.(Citation: Apple Developer Doco Hardened Runtime)
M1013,T1593,Application developers uploading to public code repositories should be careful to avoid publishing sensitive information such as credentials and API keys.
M1013,T1195,"Application developers should be cautious when selecting third-party libraries to integrate into their application. Additionally, where possible, developers should lock software dependencies to specific versions rather than pulling the latest version on build.(Citation: Cider Security Top 10 CICD Security Risks)"
M1013,T1550,"Consider implementing token binding strategies, such as Azure AD token protection or OAuth Proof of Possession, that cryptographically bind a token to a secret. This may prevent the token from being used without knowledge of the secret or possession of the device the token is tied to.(Citation: Microsoft Token Protection 2023)(Citation: Okta DPoP 2023)"
M1013,T1078,"Ensure that applications do not store sensitive data or credentials insecurely. (e.g. plaintext credentials in code, published credentials in repositories, or credentials in public cloud storage)."
M1048,T1189,"Browser sandboxes can be used to mitigate some of the impact of exploitation, but sandbox escapes may still exist.(Citation: Windows Blogs Microsoft Edge Sandbox)(Citation: Ars Technica Pwn2Own 2017 VM Escape)

Other types of virtualization and application microsegmentation may also mitigate the impact of client-side exploitation. The risks of additional exploits and weaknesses in implementation may still exist for these types of systems.(Citation: Ars Technica Pwn2Own 2017 VM Escape)"
M1048,T1611,"Consider utilizing seccomp, seccomp-bpf, or a similar solution that restricts certain system calls such as mount. In Kubernetes environments, consider defining Pod Security Standards that limit container access to host process namespaces, the host network, and the host file system.(Citation: Kubernetes Hardening Guide)"
M1048,T1190,Application isolation will limit what other processes and system features the exploited target can access.
M1048,T1203,"Browser sandboxes can be used to mitigate some of the impact of exploitation, but sandbox escapes may still exist. (Citation: Windows Blogs Microsoft Edge Sandbox) (Citation: Ars Technica Pwn2Own 2017 VM Escape)

Other types of virtualization and application microsegmentation may also mitigate the impact of client-side exploitation. Risks of additional exploits and weaknesses in those systems may still exist. (Citation: Ars Technica Pwn2Own 2017 VM Escape)"
M1048,T1212,Make it difficult for adversaries to advance their operation through exploitation of undiscovered or unpatched vulnerabilities by using sandboxing. Other types of virtualization and application microsegmentation may also mitigate the impact of some types of exploitation. Risks of additional exploits and weaknesses in these systems may still exist.(Citation: Ars Technica Pwn2Own 2017 VM Escape)
M1048,T1211,Make it difficult for adversaries to advance their operation through exploitation of undiscovered or unpatched vulnerabilities by using sandboxing. Other types of virtualization and application microsegmentation may also mitigate the impact of some types of exploitation. Risks of additional exploits and weaknesses in these systems may still exist. (Citation: Ars Technica Pwn2Own 2017 VM Escape)
M1048,T1068,Make it difficult for adversaries to advance their operation through exploitation of undiscovered or unpatched vulnerabilities by using sandboxing. Other types of virtualization and application microsegmentation may also mitigate the impact of some types of exploitation. Risks of additional exploits and weaknesses in these systems may still exist. (Citation: Ars Technica Pwn2Own 2017 VM Escape)
M1048,T1210,Make it difficult for adversaries to advance their operation through exploitation of undiscovered or unpatched vulnerabilities by using sandboxing. Other types of virtualization and application microsegmentation may also mitigate the impact of some types of exploitation. Risks of additional exploits and weaknesses in these systems may still exist. (Citation: Ars Technica Pwn2Own 2017 VM Escape)
M1048,T1559,Ensure all COM alerts and Protected View are enabled.(Citation: Microsoft Protected View)
M1047,T1548,Check for common UAC bypass weaknesses on Windows systems to be aware of the risk posture and address issues where appropriate.(Citation: Github UACMe)
M1047,T1560,System scans can be performed to identify unauthorized archival utilities.
M1047,T1176, Ensure extensions that are installed are the intended ones as many malicious extensions will masquerade as legitimate ones.
M1047,T1612,Audit images deployed within the environment to ensure they do not contain any malicious components.
M1047,T1059,Inventory systems for unauthorized command and scripting interpreter installations.
M1047,T1543,Use auditing tools capable of detecting privilege and service abuse opportunities on systems within an enterprise and correct them.
M1047,T1530,"Frequently check permissions on cloud storage to ensure proper permissions are set to deny open or unprivileged access to resources.(Citation: Amazon S3 Security, 2019)"
M1047,T1213,"Consider periodic review of accounts and privileges for critical and sensitive repositories. Ensure that repositories such as cloud-hosted databases are not unintentionally exposed to the public, and that security groups assigned to them permit only necessary and authorized hosts.(Citation: AWS DB VPC)"
M1047,T1610,"Scan images before deployment, and block those that are not in compliance with security policies. In Kubernetes environments, the admission controller can be used to validate images after a container deployment request is authenticated but before the container is deployed.(Citation: Kubernetes Hardening Guide)"
M1047,T1482,Map the trusts within existing domains/forests and keep trust relationships to a minimum.
M1047,T1484,Identify and correct GPO permissions abuse opportunities (ex: GPO modification privileges) using auditing tools such as [BloodHound](https://attack.mitre.org/software/S0521) (version 1.5.1 and later)(Citation: GitHub Bloodhound).
M1047,T1114,"Enterprise email solutions have monitoring mechanisms that may include the ability to audit auto-forwarding rules on a regular basis.

In an Exchange environment, Administrators can use Get-InboxRule to discover and remove potentially malicious auto-forwarding rules.(Citation: Microsoft Tim McMichael Exchange Mail Forwarding 2) "
M1047,T1606,"Administrators should perform an audit of all access lists and the permissions they have been granted to access web applications and services. This should be done extensively on all resources in order to establish a baseline, followed up on with periodic audits of new or updated resources. Suspicious accounts/credentials should be investigated and removed.
 
Enable advanced auditing on ADFS. Check the success and failure audit options in the ADFS Management snap-in. Enable Audit Application Generated events on the AD FS farm via Group Policy Object.(Citation: FireEye ADFS)"
M1047,T1574,"Use auditing tools capable of detecting hijacking opportunities on systems within an enterprise and correct them. Toolkits like the PowerSploit framework contain PowerUp modules that can be used to explore systems for hijacking weaknesses.(Citation: Powersploit)

Use the program sxstrace.exe that is included with Windows along with manual inspection to check manifest files for side-loading vulnerabilities in software.

Find and eliminate path interception weaknesses in program configuration files, scripts, the PATH environment variable, services, and in shortcuts by surrounding PATH variables with quotation marks when functions allow for them. Be aware of the search order Windows uses for executing or loading binaries and use fully qualified paths wherever appropriate.

Clean up old Windows Registry keys when software is uninstalled to avoid keys with no associated legitimate binaries. Periodically search for and correct or report path interception weaknesses on systems that may have been introduced using custom or available tools that report software using insecure path configurations.(Citation: Microsoft CreateProcess)(Citation: Microsoft Dynamic-Link Library Security)(Citation: Vulnerability and Exploit Detector)"
M1047,T1562,Routinely check account role permissions to ensure only expected users and roles have permission to modify defensive tools and settings.
M1047,T1525,Periodically check the integrity of images and containers used in cloud deployments to ensure they have not been modified to include malicious software.
M1047,T1036,Audit user accounts to ensure that each one has a defined purpose.
M1047,T1556,"Review authentication logs to ensure that mechanisms such as enforcement of MFA are functioning as intended.

Periodically review the hybrid identity solution in use for any discrepancies. For example, review all Pass Through Authentication (PTA) agents in the Azure Management Portal to identify any unwanted or unapproved ones.(Citation: Mandiant Azure AD Backdoors) If ADFS is in use, review DLLs and executable files in the AD FS and Global Assembly Cache directories to ensure that they are signed by Microsoft. Note that in some cases binaries may be catalog-signed, which may cause the file to appear unsigned when viewing file properties.(Citation: MagicWeb)

Periodically review for new and unknown network provider DLLs within the Registry (`HKEY_LOCAL_MACHINE\SYSTEM\CurrentControlSet\Services\<NetworkProviderName>\NetworkProvider\ProviderPath`). Ensure only valid network provider DLLs are registered. The name of these can be found in the Registry key at `HKEY_LOCAL_MACHINE\SYSTEM\CurrentControlSet\Control\NetworkProvider\Order`, and have corresponding service subkey pointing to a DLL at `HKEY_LOCAL_MACHINE\SYSTEM\CurrentC ontrolSet\Services\<NetworkProviderName>\NetworkProvider`."
M1047,T1578,Routinely monitor user permissions to ensure only the expected users have the capability to modify cloud compute infrastructure components.
M1047,T1666,"Periodically audit resource groups in the cloud management console to ensure that only expected items exist, especially close to the top of the hierarchy (e.g., AWS accounts and Azure subscriptions). Typically, top-level accounts (such as the AWS management account) should not contain any workloads or resources.(Citation: AWS Management Account Best Practices)"
M1047,T1027,Consider periodic review of common fileless storage locations (such as the Registry or WMI repository) to potentially identify abnormal and malicious data.
M1047,T1566,"Perform audits or scans of systems, permissions, insecure software, insecure configurations, etc. to identify potential weaknesses."
M1047,T1653,Periodically inspect systems for abnormal and unexpected power settings that may indicate malicious activty.
M1047,T1542,"Perform audits or scans of systems, permissions, insecure software, insecure configurations, etc. to identify potential weaknesses."
M1047,T1021,"Perform audits or scans of systems, permissions, insecure software, insecure configurations, etc. to identify potential weaknesses."
M1047,T1053,Toolkits like the PowerSploit framework contain PowerUp modules that can be used to explore systems for permission weaknesses in scheduled tasks that could be used to escalate privileges. (Citation: Powersploit)
M1047,T1593,"Scan public code repositories for exposed credentials or other sensitive information before making commits. Ensure that any leaked credentials are removed from the commit history, not just the current latest version of the code."
M1047,T1505,Regularly check component software on critical services that adversaries may target for persistence to verify the integrity of the systems and identify if unexpected changes have been made.
M1047,T1528,"Administrators should audit all cloud and container accounts to ensure that they are necessary and that the permissions granted to them are appropriate.  Additionally, administrators should perform an audit of all OAuth applications and the permissions they have been granted to access organizational data. This should be done extensively on all applications in order to establish a baseline, followed up on with periodic audits of new or updated applications. Suspicious applications should be investigated and removed."
M1047,T1539,Implement auditing for authentication activities and user logins to detect the use of stolen session cookies. Monitor for impossible travel scenarios and anomalous behavior that could indicate the use of compromised session tokens or cookies.
M1047,T1649,"Check and remediate unneeded existing authentication certificates as well as common abusable misconfigurations of CA settings and permissions, such as AD CS certificate enrollment permissions and published overly permissive certificate templates (which define available settings for created certificates). For example, available AD CS certificate templates can be checked via the Certificate Authority MMC snap-in (`certsrv.msc`). `certutil.exe` can also be used to examine various information within an AD CS CA database.(Citation: SpecterOps Certified Pre Owned)(Citation: GitHub PSPKIAudit)(Citation: GitHub Certify)"
M1047,T1558,"Perform audits or scans of systems, permissions, insecure software, insecure configurations, etc. to identify potential weaknesses."
M1047,T1552,Preemptively search for files containing passwords or other credentials and take actions to reduce the exposure risk when found.
M1047,T1550,"Perform audits or scans of systems, permissions, insecure software, insecure configurations, etc. to identify potential weaknesses."
M1040,T1059,"On Windows 10, enable Attack Surface Reduction (ASR) rules to prevent [Visual Basic](https://attack.mitre.org/techniques/T1059/005) and [JavaScript](https://attack.mitre.org/techniques/T1059/007) scripts from executing potentially malicious downloaded content (Citation: win10_asr)."
M1040,T1543,"On Windows 10, enable Attack Surface Reduction (ASR) rules to prevent an application from writing a signed vulnerable driver to the system.(Citation: Malicious Driver Reporting Center) On Windows 10 and 11, enable Microsoft Vulnerable Driver Blocklist to assist in hardening against third party-developed drivers.(Citation: Microsoft driver block rules)  "
M1040,T1486,"On Windows 10, enable cloud-delivered protection and Attack Surface Reduction (ASR) rules to block the execution of files that resemble ransomware. (Citation: win10_asr)"
M1040,T1006,"Some endpoint security solutions can be configured to block some types of behaviors related to efforts by an adversary to create backups, such as command execution or preventing API calls to backup related services."
M1040,T1574,Some endpoint security solutions can be configured to block some types of behaviors related to process injection/memory tampering based on common sequences of indicators (ex: execution of specific API functions).
M1040,T1559,"On Windows 10, enable Attack Surface Reduction (ASR) rules to prevent DDE attacks and spawning of child processes from Office programs.(Citation: Microsoft ASR Nov 2017)(Citation: Enigma Reviving DDE Jan 2018)"
M1040,T1036,"Implement security controls on the endpoint, such as a Host Intrusion Prevention System (HIPS), to identify and prevent execution of potentially malicious files (such as those with mismatching file signatures)."
M1040,T1106,"On Windows 10, enable Attack Surface Reduction (ASR) rules to prevent Office VBA macros from calling Win32 APIs. (Citation: win10_asr)"
M1040,T1003,"On Windows 10, enable Attack Surface Reduction (ASR) rules to secure LSASS and prevent credential stealing. (Citation: win10_asr)"
M1040,T1027,"On Windows 10+, enable Attack Surface Reduction (ASR) rules to prevent execution of potentially obfuscated payloads. (Citation: win10_asr)"
M1040,T1137,"On Windows 10, enable Attack Surface Reduction (ASR) rules to prevent Office applications from creating child processes and from writing potentially malicious executable content to disk. (Citation: win10_asr)"
M1040,T1055,"Some endpoint security solutions can be configured to block some types of process injection based on common sequences of behavior that occur during the injection process. For example, on Windows 10, Attack Surface Reduction (ASR) rules may prevent Office applications from code injection. (Citation: win10_asr)"
M1040,T1091,"On Windows 10, enable Attack Surface Reduction (ASR) rules to block unsigned/untrusted executable files (such as .exe, .dll, or .scr) from running from USB removable drives. (Citation: win10_asr)"
M1040,T1569,"On Windows 10, enable Attack Surface Reduction (ASR) rules to block processes created by [PsExec](https://attack.mitre.org/software/S0029) from running. (Citation: win10_asr)"
M1040,T1204,"On Windows 10, enable Attack Surface Reduction (ASR) rules to prevent executable files from running unless they meet a prevalence, age, or trusted list criteria and to prevent Office applications from creating potentially malicious executable content by blocking malicious code from being written to disk. Note: cloud-delivered protection must be enabled to use certain rules. (Citation: win10_asr)"
M1040,T1047,"On Windows 10, enable Attack Surface Reduction (ASR) rules to block processes created by WMI commands from running. Note: many legitimate tools and applications utilize WMI for command execution. (Citation: win10_asr)"
M1046,T1495,Check the integrity of the existing BIOS and device firmware to determine if it is vulnerable to modification.
M1046,T1601,"Some vendors of embedded network devices provide cryptographic signing to ensure the integrity of operating system images at boot time.  Implement where available, following vendor guidelines. (Citation: Cisco IOS Software Integrity Assurance - Secure Boot)"
M1046,T1542,Use Trusted Platform Module technology and a secure or trusted boot process to prevent system integrity from being compromised. Check the integrity of the existing BIOS or EFI to determine if it is vulnerable to modification. (Citation: TCG Trusted Platform Module) (Citation: TechNet Secure Boot Process)
M1046,T1195,Use secure methods to boot a system and verify the integrity of the operating system and loading mechanisms.
M1045,T1059,"Where possible, only permit execution of signed scripts."
M1045,T1554,Ensure all application component binaries are signed by the correct application developers.
M1045,T1543,Enforce registration and execution of only legitimately signed service drivers where possible.
M1045,T1525,Several cloud service providers support content trust models that require container images be signed by trusted sources.(Citation: Content trust in Azure Container Registry)(Citation: Content trust in Docker)
M1045,T1036,Require signed binaries.
M1045,T1601,Many vendors provide digitally signed operating system images to validate the integrity of the software used on their platform.  Make use of this feature where possible in order to prevent and/or detect attempts by adversaries to compromise the system image. (Citation: Cisco IOS Software Integrity Assurance - Deploy Signed IOS)
M1045,T1505,Ensure all application component binaries are signed by the correct application developers.
M1043,T1601,"Some embedded network devices are capable of storing passwords for local accounts in either plain-text or encrypted formats.  Ensure that, where available, local passwords are always encrypted, per vendor recommendations. (Citation: Cisco IOS Software Integrity Assurance - Credentials Management)"
M1043,T1599,"Some embedded network devices are capable of storing passwords for local accounts in either plain-text or encrypted formats.  Ensure that, where available, local passwords are always encrypted, per vendor recommendations.(Citation: Cisco IOS Software Integrity Assurance - AAA)"
