source ID,target ID,mapping description
M1035,T1609,"Limit communications with the container service to managed and secured channels, such as local Unix sockets or remote access via SSH. Require secure port access to communicate with the APIs over TLS by disabling unauthenticated access to the Docker API and Kubernetes API Server.(Citation: Docker Daemon Socket Protect)(Citation: Kubernetes API Control Access) In Kubernetes clusters deployed in cloud environments, use native cloud platform features to restrict the IP ranges that are permitted to access to API server.(Citation: Kubernetes Cloud Native Security) Where possible, consider enabling just-in-time (JIT) access to the Kubernetes API to place additional restrictions on access.(Citation: Microsoft AKS Azure AD 2023)"
M1035,T1613,"Limit communications with the container service to managed and secured channels, such as local Unix sockets or remote access via SSH. Require secure port access to communicate with the APIs over TLS by disabling unauthenticated access to the Docker API and Kubernetes API Server.(Citation: Docker Daemon Socket Protect)(Citation: Kubernetes API Control Access) In Kubernetes clusters deployed in cloud environments, use native cloud platform features to restrict the IP ranges that are permitted to access to API server.(Citation: Kubernetes Cloud Native Security) Where possible, consider enabling just-in-time (JIT) access to the Kubernetes API to place additional restrictions on access.(Citation: Microsoft AKS Azure AD 2023)"
M1035,T1610,"Limit communications with the container service to managed and secured channels, such as local Unix sockets or remote access via SSH. Require secure port access to communicate with the APIs over TLS by disabling unauthenticated access to the Docker API, Kubernetes API Server, and container orchestration web applications.(Citation: Docker Daemon Socket Protect)(Citation: Kubernetes API Control Access) In Kubernetes clusters deployed in cloud environments, use native cloud platform features to restrict the IP ranges that are permitted to access to API server.(Citation: Kubernetes Cloud Native Security) Where possible, consider enabling just-in-time (JIT) access to the Kubernetes API to place additional restrictions on access.(Citation: Microsoft AKS Azure AD 2023)"
M1035,T1133,Limit access to remote services through centrally managed concentrators such as VPNs and other managed remote access systems.
M1035,T1200,"Establish network access control policies, such as using device certificates and the 802.1x standard. (Citation: Wikipedia 802.1x) Restrict use of DHCP to registered devices to prevent unregistered devices from communicating with trusted systems."
M1035,T1542,"Prevent access to file shares, remote access to systems, unnecessary services. Mechanisms to limit access may include use of network concentrators, RDP gateways, etc."
M1035,T1021,"Prevent access to file shares, remote access to systems, unnecessary services. Mechanisms to limit access may include use of network concentrators, RDP gateways, etc."
M1035,T1552,"Limit network access to sensitive services, such as the Instance Metadata API."
M1034,T1052,Limit the use of USB devices and removable media within a network.
M1034,T1200,Block unknown devices and accessories by endpoint security configuration and monitoring agent.
M1034,T1091,Limit the use of USB devices and removable media within a network.
M1033,T1176,Only install browser extensions from trusted sources that can be verified. Browser extensions for some browsers can be controlled through Group Policy. Change settings to prevent the browser from installing extensions without sufficient permissions.
M1033,T1059,Prevent user installation of unrequired command and scripting interpreters.
M1033,T1543,Restrict software installation to trusted repositories only and be cautious of orphaned software packages.
M1033,T1564,"Restrict the installation of software that may be abused to create hidden desktops, such as hVNC, to user groups that require it."
M1033,T1072,Restrict the use of third-party software suites installed within an enterprise network. 
M1033,T1195,"Where possible, consider requiring developers to pull from internal repositories containing verified and approved packages rather than from external ones.(Citation: Cider Security Top 10 CICD Security Risks)"
M1032,T1098,Use multi-factor authentication for user and privileged accounts.
M1032,T1110,"Use multi-factor authentication. Where possible, also enable multi-factor authentication on externally facing services."
M1032,T1136,Use multi-factor authentication for user and privileged accounts.
M1032,T1485,"Implement multi-factor authentication (MFA) delete for cloud storage resources, such as AWS S3 buckets, to prevent unauthorized deletion of critical data and infrastructure. MFA delete requires additional authentication steps, making it significantly more difficult for adversaries to destroy data without proper credentials. This additional security layer helps protect against the impact of data destruction in cloud environments by ensuring that only authenticated actions can irreversibly delete storage or machine images."
M1032,T1530,"Consider using multi-factor authentication to restrict access to resources and cloud storage APIs.(Citation: Amazon S3 Security, 2019)"
M1032,T1213,Use two or more pieces of evidence to authenticate to a system; such as username and password in addition to a token from a physical smart card or token generator.
M1032,T1114,Use of multi-factor authentication for public-facing webmail servers is a recommended best practice to minimize the usefulness of usernames and passwords to adversaries.
M1032,T1133,"Use strong two-factor or multi-factor authentication for remote service accounts to mitigate an adversary's ability to leverage stolen credentials, but be aware of [Multi-Factor Authentication Interception](https://attack.mitre.org/techniques/T1111) techniques for some two-factor authentication implementations."
M1032,T1556,"Integrating multi-factor authentication (MFA) as part of organizational policy can greatly reduce the risk of an adversary gaining control of valid credentials that may be used for additional tactics such as initial access, lateral movement, and collecting information. MFA can also be used to restrict access to cloud resources and APIs. "
M1032,T1601,Use multi-factor authentication for user and privileged accounts. Most embedded network devices support TACACS+ and/or RADIUS.  Follow vendor prescribed best practices for hardening access control.(Citation: Cisco IOS Software Integrity Assurance - TACACS)
M1032,T1621,"Implement more secure 2FA/MFA mechanisms in replacement of simple push or one-click 2FA/MFA options. For example, having users enter a one-time code provided by the login screen into the 2FA/MFA application or utilizing other out-of-band 2FA/MFA mechanisms (such as rotating code-based hardware tokens providing rotating codes that need an accompanying user pin) may be more secure. Furthermore, change default configurations and implement limits upon the maximum number of 2FA/MFA request prompts that can be sent to users in period of time.(Citation: MFA Fatigue Attacks - PortSwigger)"
M1032,T1599,Use multi-factor authentication for user and privileged accounts. Most embedded network devices support TACACS+ and/or RADIUS.  Follow vendor prescribed best practices for hardening access control.(Citation: Cisco IOS Software Integrity Assurance - TACACS)
M1032,T1040,Use multi-factor authentication wherever possible.
M1032,T1021,Use multi-factor authentication on remote service logons where possible.
M1032,T1072,Ensure proper system and access isolation for critical network systems through use of multi-factor authentication.
M1032,T1539,"A physical second factor key that uses the target login domain as part of the negotiation protocol will prevent session cookie theft through proxy methods.(Citation: Evilginx 2 July 2018)

Implement Conditional Access policies with Token Protection to bind session tokens to their originating device and user. This reduces the risk of session cookie theft by ensuring that stolen tokens cannot be reused from unauthorized locations or devices."
M1032,T1199,Require MFA for all delegated administrator accounts.(Citation: Microsoft Nobelium Admin Privileges)
M1032,T1078,"Implement multi-factor authentication (MFA) across all account types, including default, local, domain, and cloud accounts, to prevent unauthorized access, even if credentials are compromised. MFA provides a critical layer of security by requiring multiple forms of verification beyond just a password. This measure significantly reduces the risk of adversaries abusing valid accounts to gain initial access, escalate privileges, maintain persistence, or evade defenses within your network."
M1031,T1557,Network intrusion detection and prevention systems that can identify traffic patterns indicative of AiTM activity can be used to mitigate activity at the network level.
M1031,T1071,Network intrusion detection and prevention systems that use network signatures to identify traffic for specific adversary malware can be used to mitigate activity at the network level.
M1031,T1132,"Network intrusion detection and prevention systems that use network signatures to identify traffic for specific adversary malware can be used to mitigate activity at the network level. Signatures are often for unique indicators within protocols and may be based on the specific obfuscation technique used by a particular adversary or tool, and will likely be different across various malware families and versions. Adversaries will likely change tool C2 signatures over time or construct protocols in such a way as to avoid detection by common defensive tools. (Citation: University of Birmingham C2)"
M1031,T1001,Network intrusion detection and prevention systems that use network signatures to identify traffic for specific adversary malware can be used to mitigate some obfuscation activity at the network level.
M1031,T1030,Network intrusion detection and prevention systems that use network signatures to identify traffic for specific adversary command and control infrastructure and malware can be used to mitigate activity at the network level.
M1031,T1602,Configure intrusion prevention devices to detect SNMP queries and commands from unauthorized sources.(Citation: US-CERT-TA18-106A)
M1031,T1568,"Network intrusion detection and prevention systems that use network signatures to identify traffic for specific adversary malware can be used to mitigate activity at the network level. Malware researchers can reverse engineer malware variants that use dynamic resolution and determine future C2 infrastructure that the malware will attempt to contact, but this is a time and resource intensive effort.(Citation: Cybereason Dissecting DGAs)(Citation: Cisco Umbrella DGA Brute Force)"
M1031,T1573,Network intrusion detection and prevention systems that use network signatures to identify traffic for specific adversary malware can be used to mitigate activity at the network level.
M1031,T1048,Network intrusion detection and prevention systems that use network signatures to identify traffic for specific adversary command and control infrastructure and malware can be used to mitigate activity at the network level.
M1031,T1041,"Network intrusion detection and prevention systems that use network signatures to identify traffic for specific adversary malware can be used to mitigate activity at the network level. Signatures are often for unique indicators within protocols and may be based on the specific obfuscation technique used by a particular adversary or tool, and will likely be different across various malware families and versions. Adversaries will likely change tool command and control signatures over time or construct protocols in such a way to avoid detection by common defensive tools. (Citation: University of Birmingham C2)"
M1031,T1008,"Network intrusion detection and prevention systems that use network signatures to identify traffic for specific adversary malware can be used to mitigate activity at the network level. Signatures are often for unique indicators within protocols and may be based on the specific protocol used by a particular adversary or tool, and will likely be different across various malware families and versions. Adversaries will likely change tool C2 signatures over time or construct protocols in such a way as to avoid detection by common defensive tools. (Citation: University of Birmingham C2)"
M1031,T1105,"Network intrusion detection and prevention systems that use network signatures to identify traffic for specific adversary malware or unusual data transfer over known protocols like FTP can be used to mitigate activity at the network level. Signatures are often for unique indicators within protocols and may be based on the specific obfuscation technique used by a particular adversary or tool, and will likely be different across various malware families and versions. Adversaries will likely change tool C2 signatures over time or construct protocols in such a way as to avoid detection by common defensive tools.(Citation: University of Birmingham C2)"
M1031,T1570,"Network intrusion detection and prevention systems that use network signatures to identify traffic for specific adversary malware or unusual data transfer over known tools and protocols like FTP can be used to mitigate activity at the network level. Signatures are often for unique indicators within protocols and may be based on the specific obfuscation technique used by a particular adversary or tool, and will likely be different across various malware families and versions. (Citation: University of Birmingham C2)"
M1031,T1104,Network intrusion detection and prevention systems that use network signatures to identify traffic for specific adversary malware can be used to mitigate activity at the network level.
M1031,T1046,Use network intrusion detection/prevention systems to detect and prevent remote service scans.
M1031,T1095,Network intrusion detection and prevention systems that use network signatures to identify traffic for specific adversary malware can be used to mitigate activity at the network level.
M1031,T1571,Network intrusion detection and prevention systems that use network signatures to identify traffic for specific adversary malware can be used to mitigate activity at the network level.
M1031,T1566,Network intrusion prevention systems and systems designed to scan and remove malicious email attachments or links can be used to block activity.
M1031,T1572,Network intrusion detection and prevention systems that use network signatures to identify traffic for specific adversary malware can be used to mitigate activity at the network level. 
M1031,T1090,"Network intrusion detection and prevention systems that use network signatures to identify traffic for specific adversary malware can be used to mitigate activity at the network level. Signatures are often for unique indicators within protocols and may be based on the specific C2 protocol used by a particular adversary or tool, and will likely be different across various malware families and versions. Adversaries will likely change tool C2 signatures over time or construct protocols in such a way as to avoid detection by common defensive tools. (Citation: University of Birmingham C2)"
M1031,T1219,Network intrusion detection and prevention systems that use network signatures may be able to prevent traffic to remote access services.
M1031,T1029,"Network intrusion detection and prevention systems that use network signatures to identify traffic for specific adversary command and control infrastructure and malware can be used to mitigate activity at the network level. Signatures are often for unique indicators within protocols and may be based on the specific obfuscation technique used by a particular adversary or tool, and will likely be different across various malware families and versions. Adversaries will likely change tool command and control signatures over time or construct protocols in such a way to avoid detection by common defensive tools. (Citation: University of Birmingham C2)"
M1031,T1221,"Network/Host intrusion prevention systems, antivirus, and detonation chambers can be employed to prevent documents from fetching and/or executing malicious payloads.(Citation: Anomali Template Injection MAR 2018)"
M1031,T1204,"If a link is being visited by a user, network intrusion prevention systems and systems designed to scan and remove malicious downloads can be used to block activity."
M1031,T1102,Network intrusion detection and prevention systems that use network signatures to identify traffic for specific adversary malware can be used to mitigate activity at the network level.
M1030,T1098,Configure access controls and firewalls to limit access to critical systems and domain controllers. Most cloud environments support separate virtual private cloud (VPC) instances that enable further segmentation of cloud systems.
M1030,T1557,"Network segmentation can be used to isolate infrastructure components that do not require broad network access. This may mitigate, or at least alleviate, the scope of AiTM activity."
M1030,T1612,"Deny direct remote access to internal systems through the use of network proxies, gateways, and firewalls."
M1030,T1613,"Deny direct remote access to internal systems through the use of network proxies, gateways, and firewalls."
M1030,T1136,Configure access controls and firewalls to limit access to domain controllers and systems used to create and manage accounts.
M1030,T1565,Identify critical business and system processes that may be targeted by adversaries and work to isolate and secure those systems against unauthorized access and tampering.
M1030,T1602,Segregate SNMP traffic on a separate management network.(Citation: US-CERT TA17-156A SNMP Abuse 2017)
M1030,T1610,"Deny direct remote access to internal systems through the use of network proxies, gateways, and firewalls."
M1030,T1482,Employ network segmentation for sensitive domains.(Citation: Harmj0y Domain Trusts).
M1030,T1048,Follow best practices for network firewall configurations to allow only necessary ports and traffic to enter and exit the network.(Citation: TechNet Firewall Design)
M1030,T1190,Segment externally facing servers and services from the rest of the network with a DMZ or on separate hosting infrastructure.
M1030,T1210,Segment networks and systems appropriately to reduce access to critical systems and services to controlled methods.
M1030,T1133,"Deny direct remote access to internal systems through the use of network proxies, gateways, and firewalls."
M1030,T1046,Ensure proper network segmentation is followed to protect critical servers and devices.
M1030,T1040,"Deny direct access of broadcasts and multicast sniffing, and prevent attacks such as [LLMNR/NBT-NS Poisoning and SMB Relay](https://attack.mitre.org/techniques/T1557/001)"
M1030,T1095,Properly configure firewalls and proxies to limit outgoing traffic to only necessary ports and through proper network gateway systems. Also ensure hosts are only provisioned to communicate over authorized interfaces.
M1030,T1571,Properly configure firewalls and proxies to limit outgoing traffic to only necessary ports for that particular network segment.
M1030,T1563,Enable firewall rules to block unnecessary traffic between network security zones within a network.
M1030,T1489,"Operate intrusion detection, analysis, and response systems on a separate network from the production environment to lessen the chances that an adversary can see and interfere with critical response functions."
M1030,T1072,Ensure proper system isolation for critical network systems through use of firewalls.
M1030,T1199,Network segmentation can be used to isolate infrastructure components that do not require broad network access.
M1028,T1548,"Applications with known vulnerabilities or known shell escapes should not have the setuid or setgid bits set to reduce potential damage if an application is compromised. Additionally, the number of programs with setuid or setgid bits set should be minimized across a system. Ensuring that the sudo tty_tickets setting is enabled will prevent this leakage across tty sessions."
M1028,T1087,Prevent administrator accounts from being enumerated when an application is elevating through UAC since it can lead to the disclosure of account names. The Registry key is located <code>HKLM\ SOFTWARE\Microsoft\Windows\CurrentVersion\Policies\CredUI\EnumerateAdministrators</code>. It can be disabled through GPO: Computer Configuration > [Policies] > Administrative Templates > Windows Components > Credential User Interface: E numerate administrator accounts on elevation. (Citation: UCF STIG Elevation Account Enumeration)
M1028,T1098,"Protect domain controllers by ensuring proper security configuration for critical servers to limit access by potentially unnecessary protocols and services, such as SMB file sharing."
M1028,T1197,"
Consider reducing the default BITS job lifetime in Group Policy or by editing the <code>JobInactivityTimeout</code> and <code>MaxDownloadTime</code> Registry values in <code> HKEY_LOCAL_MACHINE\Software\Policies\Microsoft\Windows\BITS</code>.(Citation: Microsoft BITS)"
M1028,T1092,Disallow or restrict removable media at an organizational policy level if they are not required for business operations.(Citation: TechNet Removable Media Control)
M1028,T1136,Protect domain controllers by ensuring proper security configuration for critical servers.
M1028,T1543,Ensure that Driver Signature Enforcement is enabled to restrict unsigned drivers from being installed. 
M1028,T1011,Prevent the creation of new network adapters where possible.(Citation: Microsoft GPO Bluetooth FEB 2009)(Citation: TechRepublic Wireless GPO FEB 2009)
M1028,T1490,"Consider technical controls to prevent the disabling of services or deletion of files involved in system recovery. Additionally, ensure that WinRE is enabled using the following command: <code>reagentc /enable</code>.(Citation: reagentc_cmd)"
M1028,T1556,"Ensure only valid password filters are registered. Filter DLLs must be present in Windows installation directory (`C:\Windows\System32\` by default) of a domain controller and/or local computer with a corresponding entry in `HKEY_LOCAL_MACHINE\SYSTEM\CurrentControlSet\Control\Lsa\Notification Packages`. 

Starting in Windows 11 22H2, the `EnableMPRNotifications` policy can be disabled through Group Policy or through a configuration service provider to prevent Winlogon from sending credentials to network providers.(Citation: EnableMPRNotifications)"
M1028,T1135,Enable Windows Group Policy “Do Not Allow Anonymous Enumeration of SAM Accounts and Shares” security setting to limit users who can enumerate network shares.(Citation: Windows Anonymous Enumeration of SAM Accounts)
M1028,T1003,"
Consider disabling or restricting NTLM.(Citation: Microsoft Disable NTLM Nov 2012) Consider disabling WDigest authentication.(Citation: Microsoft WDigest Mit)"
M1028,T1053,"Configure settings for scheduled tasks to force tasks to run under the context of the authenticated account instead of allowing them to run as SYSTEM. The associated Registry key is located at <code>HKLM\SYSTEM\CurrentControlSet\Control\Lsa\SubmitControl</code>. The setting can be configured through GPO: Computer Configuration > [Policies] > Windows Settings > Security Settings > Local Policies > Security Options: Domain Controller: Allow server operators to schedule tasks, set to disabled. (Citation: TechNet Server Operator Scheduled Task)"
M1028,T1553,Windows Group Policy can be used to manage root certificates and the <code>Flags</code> value of <code>HKLM\\SOFTWARE\\Policies\\Microsoft\\SystemCertificates\\Root\\ProtectedRoots</code> can be set to 1 to prevent non-administrator users from making further root installations into their own HKCU certificate store. (Citation: SpectorOps Code Signing Dec 2017)
M1028,T1552,"There are multiple methods of preventing a user's command history from being flushed to their .bash_history file, including use of the following commands:
<code>set +o history</code> and <code>set -o history</code> to start logging again;
<code>unset HISTFILE</code> being added to a user's .bash_rc file; and
<code>ln -s /dev/null ~/.bash_history</code> to write commands to <code>/dev/null</code>instead."
M1060,T1213,"Create plans for leveraging a secure out-of-band communications channel, rather than existing in-network chat applications, in case of a security incident.(Citation: TrustedSec OOB Communications)"
M1060,T1114,"Use secure out-of-band authentication methods to verify the authenticity of critical actions initiated via email, such as password resets, financial transactions, or access requests. For highly sensitive information, utilize out-of-band communication channels instead of relying solely on email to prevent adversaries from collecting data through compromised email accounts.(Citation: TrustedSec OOB Communications)"
M1060,T1489,Develop and enforce security policies that include the use of out-of-band communication channels for critical communications during a security incident.(Citation: TrustedSec OOB Communications)
M1027,T1110,Refer to NIST guidelines when creating password policies.(Citation: NIST 800-63-3)
